<?xml version="1.0" encoding="UTF-8"?>
<!-- - - - - - - - - - - - - - - - - - - - - - - - - - - - - - - - - - - - - - - - - - - -->
<!--                                                                                     -->
<!-- This file belongs to a first specification for the KWPT data interface              -->
<!-- Mathematical modelling, simulation, and optimization in the context of gas networks -->
<!--                                                                                     -->
<!-- Copyright (C) 17.11.2016                                                            -->
<!-- Developed by: Zuse Institute Berlin                                                 -->
<!-- Contact: Thorsten Koch (koch@zib.de)                                                --> 
<!-- All rights reserved.                                                                -->
<!--                                                                                     -->
<!-- Author: Oliver Kunst                                                                -->
<!--                                                                                     -->
<!-- - - - - - - - - - - - - - - - - - - - - - - - - - - - - - - - - - - - - - - - - - - -->

<measured xmlns="http://gaslab.zib.de/kwpt/measured"
    xmlns:xsi="http://www.w3.org/2001/XMLSchema-instance"
    xsi:schemaLocation="http://gaslab.zib.de/kwpt/measured ../schemes/measured-1-1-0.xsd"
    interfaceVersion="1.1.0"  source="MAG example">
    <gasDay date="2016-06-06" gasDayLengthInHours="24" gasDayStartHourInUTC="4">
        
        <!-- Die gemessenen Werte beginnen mit der ersten Stunde des Gastages -->
        <boundaryNode id="Entry1">
            <time hour="1" minute="0">
                <amountOfPower unit="MW" value="1000"/>
                <simulatedPressure unit="bar" value="55"/>
            </time>
            <!-- Es koennen unterstuendliche Werte gesetzt werden -->
            <time hour="1" minute="30">
                <amountOfPower unit="MW" value="1035"/>
                <simulatedPressure unit="bar" value="53"/>
            </time>
            <time hour="2" minute="0">
                <amountOfPower unit="MW" value="1100"/>
                <simulatedPressure unit="bar" value="50"/>
            </time>
            
            <!-- hier wuerden weitere Eitnraege folgen -->
        </boundaryNode>


        <!-- Wenn an einem Knoten der Druck gemessen wurde, so laesst sich auch das hinterlegen-->
        <boundaryNode id="Entry2">
            <time hour="1" minute="0">
                <amountOfPower unit="MW" value="900"/>
                <measuredPressure unit="bar" value="53.6"/>
            </time>
            <time hour="2" minute="0">
                <amountOfPower unit="MW" value="990"/>
                <measuredPressure unit="bar" value="51.9"/>
            </time>
            <time hour="3" minute="0">
                <amountOfPower unit="MW" value="960"/>
                <simulatedPressure unit="bar" value="53.1"/>
            </time>
            
            <!-- hier wuerden weitere Eitnraege folgen -->
        </boundaryNode>


        <!-- Wenn an einem Knoten der Druck gemessen wurde, so laesst sich auch das hinterlegen-->
        <boundaryNode id="TheExit">
            <time hour="1" minute="0">
                <amountOfPower unit="MW" value="-1800"/>
                <simulatedPressure unit="bar" value="55"/>
            </time>
            <time hour="2" minute="0">
                <amountOfPower unit="MW" value="-1690"/>
                <simulatedPressure unit="bar" value="58"/>
            </time>

            <time hour="3" minute="0">
                <amountOfPower unit="MW" value="-2000"/>
                <simulatedPressure unit="bar" value="60"/>
            </time>
            
            <!-- hier wuerden weitere Eitnraege folgen -->
        </boundaryNode>
        
    </gasDay>
</measured>